{"identity_source":"owner-approved-immutable-git-objects","production":{"deploy":"NOT RUN","infrastructure":"NOT RUN","rollback":"NOT RUN","smoke":"NOT RUN"},"publication_policy":[{"mode":"100644","path":"evidence/phase-474/final-source-handoff.json","status":"A"},{"mode":"100644","path":".planning/phases/474-deterministic-verification-and-gated-delivery/474-93-SUMMARY.md","status":"A"},{"mode":"100644","path":".planning/ROADMAP.md","status":"M"},{"mode":"100644","path":".planning/STATE.md","status":"M"}],"repositories":[{"commit":"17858f892ed60d8e520f1adc136248b05b092f97","lock_path":"uv.lock","lock_sha256":"68efeb83c23ff4683cba1ff735130c365e8f9ec16dfb0eff5959a827536748fa","name":"backend","tree":"1746499327663d8babe4404b3f5201f315821e99"},{"commit":"13c4d1067492eead665999d2b43cd359141a6dd6","lock_path":"package-lock.json","lock_sha256":"2a7762935fa88be068efa1cd3230e87cbc1e8899e4857a791a563da6d5ba5c17","name":"frontend","tree":"e2d4cdabc6e6563c61e924b0fd9a2c5fd97e75bf"},{"commit":"6d545ad8cae8d2fe67087f298d9d5fc7cc29b3f6","lock_path":"uv.lock","lock_sha256":"8c84a57b55b663b315f7d1b689e4f8ef6eba2c10c5b357d8914932731778bfd9","name":"infra","tree":"bb279d0f076a29fd0b83280c818289597446a45d"}],"schema":"stoa.release.source-handoff.v1","tuple_sha256":"8a0ad72a5a69e0a97f3885266c9587c940c0adfab5a92ec6d5bb846298665898"}
